{
  "$schema": "../../schema/client.schema.json",
  "client_id": "qa-iss-c69ffd",
  "protocol": "oidc",
  "name": {
    "en": "Issue Path Check c69ffd"
  },
  "homepage": "https://qa-iss-c69ffd.fadianro.am/",
  "domain": "qa-iss-c69ffd.fadianro.am",
  "contact": {
    "github": "yunzheng2006",
    "email": "support@yunzheng.space"
  },
  "redirect_uris": [
    "https://qa-iss-c69ffd.fadianro.am/cb"
  ],
  "token_endpoint_auth_method": "none",
  "subject_type": "public",
  "status": "disabled",
  "note": "Disabled. Test entry from the verification of the issue-form registration path on 2026-10-08."
}
