{
  "$schema": "../../schema/client.schema.json",
  "client_id": "qa-am-f93985",
  "protocol": "oidc",
  "name": {
    "en": "Automerge Check f93985"
  },
  "homepage": "https://qa-am-f93985.fadianro.am/",
  "domain": "qa-am-f93985.fadianro.am",
  "contact": {
    "github": "yunzheng2006",
    "email": "support@yunzheng.space"
  },
  "redirect_uris": [
    "https://qa-am-f93985.fadianro.am/cb"
  ],
  "token_endpoint_auth_method": "none",
  "subject_type": "public",
  "status": "active"
}
